{
  "record_id": "2025-11-03_IMISCOE_0018",
  "interview_date": "2025-11-03",
  "interviewer": "Maria da Costa (0000-0002-1234-5678)",
  "consent_status": "specific-project-only",
  "accessRights": "closed",
  "title": "Interview with a second-generation respondent in Rotterdam",
  "language": "nld"
}
